{"SchemaVersion":"amd-graphics-product-catalog/2.0","ToolkitVersion":"1.0.0","GeneratedAtUtc":"2026-08-12T17:12:27.7193969Z","Completeness":"CuratedProductGroupCatalog","CoverageStatus":"CuratedResearchScope","CanClaimFullProductCatalog":false,"CatalogKind":"CuratedProductGroups","CatalogVersion":"2026-08-11.2","CatalogScope":"Windows 10/11 and Windows Server static graphics-driver research for current and recent AMD Radeon dGPU/professional and Ryzen processor-integrated Radeon product groups. Each row is an AMD official support page used as a representative entry point for one product group; it is not a claim to enumerate every product model.","CatalogCoveragePolicy":"RepresentativeProductPerProductGroup","CatalogExcludedByDefault":["Radeon R9/R7/R5 legacy families","Radeon HD legacy families","FirePro legacy families","mobile-only professional groups unless explicitly added","embedded graphics families unless explicitly added"],"ProductCount":21,"ProductGroupCount":21,"Products":[{"ProductKey":"graphics|radeon-600-500-400|radeon-rx-500-series|radeon-rx-580","ProductGroupKey":"graphics|radeon-600-500-400|radeon-rx-500-series","RootCategory":"graphics","ProductFamilySlug":"radeon-600-500-400","ProductLineSlug":"radeon-rx-500-series","ProductModelSlug":"radeon-rx-580","PathSegments":["graphics","radeon-600-500-400","radeon-rx-500-series","radeon-rx-580.html"],"LatestPageUrl":"https://www.amd.com/en/support/downloads/drivers.html/graphics/radeon-600-500-400/radeon-rx-500-series/radeon-rx-580.html","PreviousPageUrl":"https://www.amd.com/en/support/downloads/previous-drivers.html/graphics/radeon-600-500-400/radeon-rx-500-series/radeon-rx-580.html","FallbackLatestPageUrls":[],"FallbackPreviousPageUrls":[],"ProductGroupDisplayName":"Radeon RX 500 Series","GraphicsKind":"dGPU","DiscoverySource":"Curated","DiscoveryDetail":"Polaris legacy desktop representative.","DiscoveredAtUtc":"2026-08-12T17:12:27.6850261Z"},{"ProductKey":"graphics|radeon-ai-pro|radeon-ai-pro-r9000-series|amd-radeon-ai-pro-r9700","ProductGroupKey":"graphics|radeon-ai-pro|radeon-ai-pro-r9000-series","RootCategory":"graphics","ProductFamilySlug":"radeon-ai-pro","ProductLineSlug":"radeon-ai-pro-r9000-series","ProductModelSlug":"amd-radeon-ai-pro-r9700","PathSegments":["graphics","radeon-ai-pro","radeon-ai-pro-r9000-series","amd-radeon-ai-pro-r9700.html"],"LatestPageUrl":"https://www.amd.com/en/support/downloads/drivers.html/graphics/radeon-ai-pro/radeon-ai-pro-r9000-series/amd-radeon-ai-pro-r9700.html","PreviousPageUrl":"https://www.amd.com/en/support/downloads/previous-drivers.html/graphics/radeon-ai-pro/radeon-ai-pro-r9000-series/amd-radeon-ai-pro-r9700.html","FallbackLatestPageUrls":[],"FallbackPreviousPageUrls":[],"ProductGroupDisplayName":"Radeon AI PRO R9000 Series","GraphicsKind":"dGPU-Pro","DiscoverySource":"Curated","DiscoveryDetail":"Current AI workstation graphics representative.","DiscoveredAtUtc":"2026-08-12T17:12:27.6850261Z"},{"ProductKey":"graphics|radeon-pro|radeon-pro-w5000-series|radeon-pro-w5700","ProductGroupKey":"graphics|radeon-pro|radeon-pro-w5000-series","RootCategory":"graphics","ProductFamilySlug":"radeon-pro","ProductLineSlug":"radeon-pro-w5000-series","ProductModelSlug":"radeon-pro-w5700","PathSegments":["graphics","radeon-pro","radeon-pro-w5000-series","radeon-pro-w5700.html"],"LatestPageUrl":"https://www.amd.com/en/support/downloads/drivers.html/graphics/radeon-pro/radeon-pro-w5000-series/radeon-pro-w5700.html","PreviousPageUrl":"https://www.amd.com/en/support/downloads/previous-drivers.html/graphics/radeon-pro/radeon-pro-w5000-series/radeon-pro-w5700.html","FallbackLatestPageUrls":[],"FallbackPreviousPageUrls":[],"ProductGroupDisplayName":"Radeon PRO W5000 Series","GraphicsKind":"dGPU-Pro","DiscoverySource":"Curated","DiscoveryDetail":"RDNA 1 workstation representative.","DiscoveredAtUtc":"2026-08-12T17:12:27.6880270Z"},{"ProductKey":"graphics|radeon-pro|radeon-pro-w6000-series|amd-radeon-pro-w6400","ProductGroupKey":"graphics|radeon-pro|radeon-pro-w6000-series","RootCategory":"graphics","ProductFamilySlug":"radeon-pro","ProductLineSlug":"radeon-pro-w6000-series","ProductModelSlug":"amd-radeon-pro-w6400","PathSegments":["graphics","radeon-pro","radeon-pro-w6000-series","amd-radeon-pro-w6400.html"],"LatestPageUrl":"https://www.amd.com/en/support/downloads/drivers.html/graphics/radeon-pro/radeon-pro-w6000-series/amd-radeon-pro-w6400.html","PreviousPageUrl":"https://www.amd.com/en/support/downloads/previous-drivers.html/graphics/radeon-pro/radeon-pro-w6000-series/amd-radeon-pro-w6400.html","FallbackLatestPageUrls":[],"FallbackPreviousPageUrls":[],"ProductGroupDisplayName":"Radeon PRO W6000 Series","GraphicsKind":"dGPU-Pro","DiscoverySource":"Curated","DiscoveryDetail":"Workstation and Windows Server reference representative.","DiscoveredAtUtc":"2026-08-12T17:12:27.6870260Z"},{"ProductKey":"graphics|radeon-pro|radeon-pro-w7000-series|amd-radeon-pro-w7800","ProductGroupKey":"graphics|radeon-pro|radeon-pro-w7000-series","RootCategory":"graphics","ProductFamilySlug":"radeon-pro","ProductLineSlug":"radeon-pro-w7000-series","ProductModelSlug":"amd-radeon-pro-w7800","PathSegments":["graphics","radeon-pro","radeon-pro-w7000-series","amd-radeon-pro-w7800.html"],"LatestPageUrl":"https://www.amd.com/en/support/downloads/drivers.html/graphics/radeon-pro/radeon-pro-w7000-series/amd-radeon-pro-w7800.html","PreviousPageUrl":"https://www.amd.com/en/support/downloads/previous-drivers.html/graphics/radeon-pro/radeon-pro-w7000-series/amd-radeon-pro-w7800.html","FallbackLatestPageUrls":[],"FallbackPreviousPageUrls":[],"ProductGroupDisplayName":"Radeon PRO W7000 Series","GraphicsKind":"dGPU-Pro","DiscoverySource":"Curated","DiscoveryDetail":"RDNA 3 workstation representative.","DiscoveredAtUtc":"2026-08-12T17:12:27.6860269Z"},{"ProductKey":"graphics|radeon-rx|radeon-rx-5000-series|amd-radeon-rx-5700","ProductGroupKey":"graphics|radeon-rx|radeon-rx-5000-series","RootCategory":"graphics","ProductFamilySlug":"radeon-rx","ProductLineSlug":"radeon-rx-5000-series","ProductModelSlug":"amd-radeon-rx-5700","PathSegments":["graphics","radeon-rx","radeon-rx-5000-series","amd-radeon-rx-5700.html"],"LatestPageUrl":"https://www.amd.com/en/support/downloads/drivers.html/graphics/radeon-rx/radeon-rx-5000-series/amd-radeon-rx-5700.html","PreviousPageUrl":"https://www.amd.com/en/support/downloads/previous-drivers.html/graphics/radeon-rx/radeon-rx-5000-series/amd-radeon-rx-5700.html","FallbackLatestPageUrls":[],"FallbackPreviousPageUrls":[],"ProductGroupDisplayName":"Radeon RX 5000 Series","GraphicsKind":"dGPU","DiscoverySource":"Curated","DiscoveryDetail":"RDNA 1 Radeon RX desktop representative.","DiscoveredAtUtc":"2026-08-12T17:12:27.6830266Z"},{"ProductKey":"graphics|radeon-rx|radeon-rx-6000-series|amd-radeon-rx-6750-xt","ProductGroupKey":"graphics|radeon-rx|radeon-rx-6000-series","RootCategory":"graphics","ProductFamilySlug":"radeon-rx","ProductLineSlug":"radeon-rx-6000-series","ProductModelSlug":"amd-radeon-rx-6750-xt","PathSegments":["graphics","radeon-rx","radeon-rx-6000-series","amd-radeon-rx-6750-xt.html"],"LatestPageUrl":"https://www.amd.com/en/support/downloads/drivers.html/graphics/radeon-rx/radeon-rx-6000-series/amd-radeon-rx-6750-xt.html","PreviousPageUrl":"https://www.amd.com/en/support/downloads/previous-drivers.html/graphics/radeon-rx/radeon-rx-6000-series/amd-radeon-rx-6750-xt.html","FallbackLatestPageUrls":[],"FallbackPreviousPageUrls":[],"ProductGroupDisplayName":"Radeon RX 6000 Series","GraphicsKind":"dGPU","DiscoverySource":"Curated","DiscoveryDetail":"RDNA 2 Radeon RX desktop representative.","DiscoveredAtUtc":"2026-08-12T17:12:27.6820268Z"},{"ProductKey":"graphics|radeon-rx|radeon-rx-7000-series|amd-radeon-rx-7900-xtx","ProductGroupKey":"graphics|radeon-rx|radeon-rx-7000-series","RootCategory":"graphics","ProductFamilySlug":"radeon-rx","ProductLineSlug":"radeon-rx-7000-series","ProductModelSlug":"amd-radeon-rx-7900-xtx","PathSegments":["graphics","radeon-rx","radeon-rx-7000-series","amd-radeon-rx-7900-xtx.html"],"LatestPageUrl":"https://www.amd.com/en/support/downloads/drivers.html/graphics/radeon-rx/radeon-rx-7000-series/amd-radeon-rx-7900-xtx.html","PreviousPageUrl":"https://www.amd.com/en/support/downloads/previous-drivers.html/graphics/radeon-rx/radeon-rx-7000-series/amd-radeon-rx-7900-xtx.html","FallbackLatestPageUrls":[],"FallbackPreviousPageUrls":[],"ProductGroupDisplayName":"Radeon RX 7000 Series","GraphicsKind":"dGPU","DiscoverySource":"Curated","DiscoveryDetail":"RDNA 3 Radeon RX desktop representative.","DiscoveredAtUtc":"2026-08-12T17:12:27.6810285Z"},{"ProductKey":"graphics|radeon-rx|radeon-rx-9000-series|amd-radeon-rx-9070-xt","ProductGroupKey":"graphics|radeon-rx|radeon-rx-9000-series","RootCategory":"graphics","ProductFamilySlug":"radeon-rx","ProductLineSlug":"radeon-rx-9000-series","ProductModelSlug":"amd-radeon-rx-9070-xt","PathSegments":["graphics","radeon-rx","radeon-rx-9000-series","amd-radeon-rx-9070-xt.html"],"LatestPageUrl":"https://www.amd.com/en/support/downloads/drivers.html/graphics/radeon-rx/radeon-rx-9000-series/amd-radeon-rx-9070-xt.html","PreviousPageUrl":"https://www.amd.com/en/support/downloads/previous-drivers.html/graphics/radeon-rx/radeon-rx-9000-series/amd-radeon-rx-9070-xt.html","FallbackLatestPageUrls":[],"FallbackPreviousPageUrls":[],"ProductGroupDisplayName":"Radeon RX 9000 Series","GraphicsKind":"dGPU","DiscoverySource":"Curated","DiscoveryDetail":"Current Radeon RX desktop generation representative.","DiscoveredAtUtc":"2026-08-12T17:12:27.6793909Z"},{"ProductKey":"graphics|radeon-rx|radeon-rx-vega-series|amd-radeon-vii","ProductGroupKey":"graphics|radeon-rx|radeon-rx-vega-series","RootCategory":"graphics","ProductFamilySlug":"radeon-rx","ProductLineSlug":"radeon-rx-vega-series","ProductModelSlug":"amd-radeon-vii","PathSegments":["graphics","radeon-rx","radeon-rx-vega-series","amd-radeon-vii.html"],"LatestPageUrl":"https://www.amd.com/en/support/downloads/drivers.html/graphics/radeon-rx/radeo